{
  "schemaVersion": 1,
  "kind": "scenario",
  "name": "YouTube_20_검색어_3종탐색_DRAM",
  "description": "검색어마다 앱을 재실행하여 검색창 상태를 초기화합니다. 반복 블록 1회. 앱 실행 → 검색창 열기 → lofi hip hop 검색 → 3초 대기 → 검색 결과 광고 기록 → down 방향 3회 탐색 · 광고 카드 기록 → 앱 실행 → 검색창 열기 → nature documentary 검색 → 3초 대기 → 검색 결과 광고 기록 → down 방향 3회 탐색 · 광고 카드 기록 → 앱 실행 → 검색창 열기 → space documentary 검색 → 3초 대기 → 검색 결과 광고 기록 → down 방향 3회 탐색 · 광고 카드 기록 FSIO UFS+DRAM 수집. 재생 시간은 광고·미확인을 제외한 표본 간 관측 시간이며 마지막 조회 간격만큼 늘어날 수 있습니다. 광고 조회가 측정 부하를 추가합니다. 잠금 해제·YouTube 초기 안내 완료가 필요합니다. 반복 중 같은 영상이 다시 나올 수 있습니다. 전체 반복·장시간 실행 검증 전이며 개별 공통 동작의 검증과 구분합니다.",
  "repeatCount": 1,
  "steps": [
    {
      "params": {
        "include_dram": "true",
        "include_vfs": "false",
        "label": "FSIO UFS + DRAM 수집 시작",
        "trace_type": "fsio_ufs",
        "window_seconds": "1"
      },
      "type": "trace_start"
    },
    {
      "type": "launch_app",
      "params": {
        "label": "앱 실행",
        "package_name": "com.google.android.youtube",
        "clear_mode": "force_stop",
        "wait_seconds": "3"
      }
    },
    {
      "type": "tap_element",
      "params": {
        "label": "검색창 열기",
        "element_content_desc": "^(검색|Search)$",
        "element_match_mode": "regex"
      }
    },
    {
      "type": "text",
      "params": {
        "label": "lofi hip hop 검색",
        "input_text": "lofi hip hop",
        "submit": "true"
      }
    },
    {
      "type": "sleep",
      "params": {
        "label": "3초 대기",
        "seconds": "3"
      }
    },
    {
      "type": "youtube",
      "params": {
        "label": "검색 결과 광고 기록",
        "action": "inspect"
      }
    },
    {
      "type": "youtube",
      "params": {
        "label": "down 방향 3회 탐색 · 광고 카드 기록",
        "action": "feed",
        "count": "3",
        "direction": "down"
      }
    },
    {
      "type": "launch_app",
      "params": {
        "label": "앱 실행",
        "package_name": "com.google.android.youtube",
        "clear_mode": "force_stop",
        "wait_seconds": "3"
      }
    },
    {
      "type": "tap_element",
      "params": {
        "label": "검색창 열기",
        "element_content_desc": "^(검색|Search)$",
        "element_match_mode": "regex"
      }
    },
    {
      "type": "text",
      "params": {
        "label": "nature documentary 검색",
        "input_text": "nature documentary",
        "submit": "true"
      }
    },
    {
      "type": "sleep",
      "params": {
        "label": "3초 대기",
        "seconds": "3"
      }
    },
    {
      "type": "youtube",
      "params": {
        "label": "검색 결과 광고 기록",
        "action": "inspect"
      }
    },
    {
      "type": "youtube",
      "params": {
        "label": "down 방향 3회 탐색 · 광고 카드 기록",
        "action": "feed",
        "count": "3",
        "direction": "down"
      }
    },
    {
      "type": "launch_app",
      "params": {
        "label": "앱 실행",
        "package_name": "com.google.android.youtube",
        "clear_mode": "force_stop",
        "wait_seconds": "3"
      }
    },
    {
      "type": "tap_element",
      "params": {
        "label": "검색창 열기",
        "element_content_desc": "^(검색|Search)$",
        "element_match_mode": "regex"
      }
    },
    {
      "type": "text",
      "params": {
        "label": "space documentary 검색",
        "input_text": "space documentary",
        "submit": "true"
      }
    },
    {
      "type": "sleep",
      "params": {
        "label": "3초 대기",
        "seconds": "3"
      }
    },
    {
      "type": "youtube",
      "params": {
        "label": "검색 결과 광고 기록",
        "action": "inspect"
      }
    },
    {
      "type": "youtube",
      "params": {
        "label": "down 방향 3회 탐색 · 광고 카드 기록",
        "action": "feed",
        "count": "3",
        "direction": "down"
      }
    },
    {
      "type": "stop_app",
      "params": {
        "label": "YouTube 종료",
        "package_name": "com.google.android.youtube"
      }
    },
    {
      "params": {
        "label": "Trace 종료 및 결과 저장",
        "trace_type": "fsio_ufs"
      },
      "type": "trace_stop"
    }
  ],
  "loops": [],
  "requirements": {
    "packages": [
      "com.google.android.youtube"
    ],
    "traceType": "fsio_ufs"
  }
}
