{
  "schemaVersion": 1,
  "kind": "scenario",
  "name": "YouTube_18_고정화질_1080p_3분_DRAM",
  "description": "요청 화질을 지원하는 영상과 필요 시 Tesseract eng/kor가 필요합니다. 반복 블록 1회. 1080p 선택·확인 → 본영상 180초 관측 · 광고 제외 FSIO UFS+DRAM 수집. 재생 시간은 광고·미확인을 제외한 표본 간 관측 시간이며 마지막 조회 간격만큼 늘어날 수 있습니다. 광고 조회가 측정 부하를 추가합니다. 잠금 해제·YouTube 초기 안내 완료가 필요합니다. 반복 중 같은 영상이 다시 나올 수 있습니다. 전체 반복·장시간 실행 검증 전이며 개별 공통 동작의 검증과 구분합니다.",
  "repeatCount": 1,
  "steps": [
    {
      "params": {
        "include_dram": "true",
        "include_vfs": "false",
        "label": "FSIO UFS + DRAM 수집 시작",
        "trace_type": "fsio_ufs",
        "window_seconds": "1"
      },
      "type": "trace_start"
    },
    {
      "params": {
        "clear_mode": "force_stop",
        "label": "YouTube 앱 실행",
        "package_name": "com.google.android.youtube",
        "wait_activity": "HomeActivity",
        "wait_seconds": "3"
      },
      "type": "launch_app"
    },
    {
      "params": {
        "element_content_desc": "검색",
        "label": "검색창 열기"
      },
      "type": "tap_element"
    },
    {
      "params": {
        "input_text": "Best of lofi hip hop 2021",
        "label": "화질 비교용 긴 영상 검색",
        "submit": "true"
      },
      "type": "text"
    },
    {
      "params": {
        "label": "검색 결과 로딩 대기",
        "seconds": "3"
      },
      "type": "sleep"
    },
    {
      "params": {
        "action": "inspect",
        "label": "검색 결과 광고 표시 확인"
      },
      "type": "youtube"
    },
    {
      "params": {
        "action": "select_video",
        "label": "광고·Shorts를 제외한 일반 영상 선택",
        "title": "Best of lofi hip hop 2021"
      },
      "type": "youtube"
    },
    {
      "params": {
        "action": "watch",
        "ad_timeout": "180",
        "label": "광고 종료·본영상 준비 확인",
        "seconds": "0"
      },
      "type": "youtube"
    },
    {
      "type": "youtube",
      "params": {
        "label": "1080p 선택·확인",
        "action": "quality",
        "quality": "1080p"
      }
    },
    {
      "type": "youtube",
      "params": {
        "label": "본영상 180초 관측 · 광고 제외",
        "action": "watch",
        "seconds": "180",
        "surface": "video",
        "ad_timeout": "180"
      }
    },
    {
      "type": "stop_app",
      "params": {
        "label": "YouTube 종료",
        "package_name": "com.google.android.youtube"
      }
    },
    {
      "params": {
        "label": "Trace 종료 및 결과 저장",
        "trace_type": "fsio_ufs"
      },
      "type": "trace_stop"
    }
  ],
  "loops": [],
  "requirements": {
    "packages": [
      "com.google.android.youtube"
    ],
    "traceType": "fsio_ufs"
  }
}
